{"artifact":{"binary_architecture":"x86_64","binary_digest":"aaaaaaaaaaaaaaaaaaaaaaaaaaaaaaaaaaaaaaaaaaaaaaaaaaaaaaaaaaaaaaaa","binary_size":1,"inner_payload_digest":"aaaaaaaaaaaaaaaaaaaaaaaaaaaaaaaaaaaaaaaaaaaaaaaaaaaaaaaaaaaaaaaa","inner_payload_size":1,"service_zip_digest":"aaaaaaaaaaaaaaaaaaaaaaaaaaaaaaaaaaaaaaaaaaaaaaaaaaaaaaaaaaaaaaaa","service_zip_size":1},"binding":{"attestation_digest":"aaaaaaaaaaaaaaaaaaaaaaaaaaaaaaaaaaaaaaaaaaaaaaaaaaaaaaaaaaaaaaaa","attestation_id":1,"core_digest":"aaaaaaaaaaaaaaaaaaaaaaaaaaaaaaaaaaaaaaaaaaaaaaaaaaaaaaaaaaaaaaaa","final_manifest_artifact_digest":"sha256:aaaaaaaaaaaaaaaaaaaaaaaaaaaaaaaaaaaaaaaaaaaaaaaaaaaaaaaaaaaaaaaa","final_manifest_artifact_id":1,"final_manifest_digest":"aaaaaaaaaaaaaaaaaaaaaaaaaaaaaaaaaaaaaaaaaaaaaaaaaaaaaaaaaaaaaaaa","predicate_path":"attestations/velnor-policy-validator-binding.v1.json","predicate_type":"https://velnor.dev/attestations/policy-validator-binding/v1","subject_digest":"sha256:aaaaaaaaaaaaaaaaaaaaaaaaaaaaaaaaaaaaaaaaaaaaaaaaaaaaaaaaaaaaaaaa","subject_name":"x"},"caller_workflow":{"capture_step_id":"x","file_blob_sha":"aaaaaaaaaaaaaaaaaaaaaaaaaaaaaaaaaaaaaaaa","path":"x","ref":"x","run_attempt":1,"run_id":1,"workflow_sha":"aaaaaaaaaaaaaaaaaaaaaaaaaaaaaaaaaaaaaaaa"},"canonical_release_schema_sha256":"aaaaaaaaaaaaaaaaaaaaaaaaaaaaaaaaaaaaaaaaaaaaaaaaaaaaaaaaaaaaaaaa","canonical_root_manifest_sha256":"aaaaaaaaaaaaaaaaaaaaaaaaaaaaaaaaaaaaaaaaaaaaaaaaaaaaaaaaaaaaaaaa","producer":{"check_run_id":1,"job_id":1,"job_workflow_sha":"aaaaaaaaaaaaaaaaaaaaaaaaaaaaaaaaaaaaaaaa","run_attempt":1,"run_id":1,"workflow_file_blob_sha":"aaaaaaaaaaaaaaaaaaaaaaaaaaaaaaaaaaaaaaaa","workflow_path":"x","workflow_ref":"x"},"product":{"architecture":"x86_64","name":"velnor-workflow-policy-validator","namespace":"velnor.workflow-policy-validator","platform":"Linux-X64"},"record_kind":"policy-validator-b-pre-provider","release":{"asset_digest":"sha256:aaaaaaaaaaaaaaaaaaaaaaaaaaaaaaaaaaaaaaaaaaaaaaaaaaaaaaaaaaaaaaaa","asset_id":1,"manifest_digest":"aaaaaaaaaaaaaaaaaaaaaaaaaaaaaaaaaaaaaaaaaaaaaaaaaaaaaaaaaaaaaaaa","release_id":1,"tag":"velnor-workflow-policy-validator-v1-aaaaaaaaaaaaaaaaaaaaaaaaaaaaaaaaaaaaaaaa","target_sha":"aaaaaaaaaaaaaaaaaaaaaaaaaaaaaaaaaaaaaaaa"},"release_attestation":{"attestation_digest":"aaaaaaaaaaaaaaaaaaaaaaaaaaaaaaaaaaaaaaaaaaaaaaaaaaaaaaaaaaaaaaaa","attestation_id":1,"certificate_identity":"x","certificate_verified":true,"manifest_subject_sha256":"aaaaaaaaaaaaaaaaaaaaaaaaaaaaaaaaaaaaaaaaaaaaaaaaaaaaaaaaaaaaaaaa","oidc_issuer":"https://token.actions.githubusercontent.com","oidc_policy_revision_sha256":"aaaaaaaaaaaaaaaaaaaaaaaaaaaaaaaaaaaaaaaaaaaaaaaaaaaaaaaaaaaaaaaa","predicate_path":"attestations/velnor-policy-validator-release.v1.json","predicate_type":"https://velnor.dev/attestations/velnor-policy-validator-release/v1","signer_repository":"x","signer_source_ref":"refs/heads/main","signer_workflow":"x"},"schema_version":"2","source":{"closure_digest":"aaaaaaaaaaaaaaaaaaaaaaaaaaaaaaaaaaaaaaaaaaaaaaaaaaaaaaaaaaaaaaaa","ref":"x","repository":"x","sha":"aaaaaaaaaaaaaaaaaaaaaaaaaaaaaaaaaaaaaaaa","tree_sha":"aaaaaaaaaaaaaaaaaaaaaaaaaaaaaaaaaaaaaaaa"},"verification":{"binding_preimage_sha256":"aaaaaaaaaaaaaaaaaaaaaaaaaaaaaaaaaaaaaaaaaaaaaaaaaaaaaaaaaaaaaaaa","raw_downloads_equal_digests":true,"release_preimage_sha256":"aaaaaaaaaaaaaaaaaaaaaaaaaaaaaaaaaaaaaaaaaaaaaaaaaaaaaaaaaaaaaaaa","required_step_conclusions":{"artifact-verify":"success","attest-binding":"success","attest-release":"success","build-linux-x64":"success","publish":"success","reserve-release":"success"}}}
